{
  "schemaVersion": 0,
  "id": "trigger.welcome-sign",
  "name": "Welcome Sign Trigger",
  "promptId": "prompt.welcome",
  "eventId": "event.sign.read",
  "targetEntityId": "entity.player",
  "activation": {
    "shape": {
      "kind": "circle",
      "data": {
        "radius": 1.0
      }
    }
  },
  "repeatable": true,
  "tags": ["interaction", "sign"]
}
